{
  "schema_version": "r0mh-results-v1",
  "chip": "Apple M4 Max",
  "chip_key": "apple-m4-max",
  "status": "measured",
  "hardware": {
    "cpu_cores": 16,
    "cpu_performance_cores": 12,
    "cpu_efficiency_cores": 4,
    "gpu_cores": 40,
    "ram_bytes": 51539607552
  },
  "os": {
    "name": "macOS",
    "version": "26.0",
    "build": "25A353",
    "metal_argument_buffers_tier": "Tier2"
  },
  "risc0": {
    "zkvm": "=3.0.5",
    "zkp": "3.0.4",
    "circuit_rv32im": "=4.0.4",
    "r0vm": "risc0-r0vm 3.0.5",
    "cargo_risczero": "cargo-risczero 3.0.5"
  },
  "toolchain": {
    "rustc": "rustc 1.97.0-nightly (82bee9650 2026-05-09)",
    "cargo": "cargo 1.97.0-nightly (a343accce 2026-05-08)"
  },
  "bench_runs": 8,
  "workloads": [
    {
      "name": "hello",
      "segments": 1,
      "knobs": {},
      "metal": { "median_ms": 799.6, "runs": 8, "receipt_verified": true, "peak_rss_mb": 367.8 },
      "cpu": { "median_ms": 1310.1, "runs": 8, "receipt_verified": true, "peak_rss_mb": 346.3 },
      "speedup": 1.638,
      "evidence": {
        "bundle": "evidence/20260616T133558Z",
        "evidence_json_sha256": "c400bf192ab675b2146ca11743836de0e8871e2125761581033902d83fde7813",
        "metal_csv_sha256": "78e93a7133c6dda286f069c02b21a4da930ed5ac2bac2311425a0e29c6a47af4",
        "cpu_csv_sha256": "edb2c29e89a406ff944c9861633fe20ca510b392153f96b7f4fac6f0e45fecb4",
        "profile_log_sha256": "2b214392ba13f9f43797c2eeb72a1e2570623920dab5cfd2d1d9cf0c0fb52912",
        "notes": "v0.3.0 release-tree re-measure: validate.sh --full --require-metal PASS 34/0/0 on master @ a884a158, 8 serial runs/lane, receipt verified + journal asserted each run. Canonical JSON is evidence.json; metal/cpu CSVs are bench/hello-{metal,cpu}.csv; profile_log is logs/profile-hello-metal.log (the lane-invariant circuit floor it establishes bounds every workload — RESULT.md)."
      }
    },
    {
      "name": "hash",
      "knobs": { "R0_HASH_ITERS": "512" },
      "metal": { "median_ms": 61984.9, "runs": 8, "receipt_verified": true, "peak_rss_mb": 8205.5 },
      "cpu": { "median_ms": 108348.9, "runs": 8, "receipt_verified": true, "peak_rss_mb": 13552.8 },
      "speedup": 1.748,
      "evidence": {
        "bundle": "evidence/20260616T133558Z",
        "evidence_json_sha256": "c400bf192ab675b2146ca11743836de0e8871e2125761581033902d83fde7813",
        "metal_csv_sha256": "16cdf9deca90b6d45b01b363c476df72fd51c9edded36c5ef4e53e6e15aa9c58",
        "cpu_csv_sha256": "b1bdee5d2b46c75ab3dc5dc52299bf49efcd0a73dc3488c14bd4addbd93658ce",
        "profile_log_sha256": null,
        "notes": "v0.3.0 release-tree re-measure (validate.sh --full --require-metal, master @ a884a158); canonical JSON is evidence.json; CSVs are bench/hash-{metal,cpu}.csv. profile_log is null: validate.sh profiles only `hello`, so no logs/profile-hash-metal.log exists; the lane-invariant floor is confirmed for `hash` in RESULT.md's phase table."
      }
    },
    {
      "name": "busy",
      "knobs": { "R0_BUSY_ITERS": "1000000" },
      "metal": { "median_ms": 150091.8, "runs": 8, "receipt_verified": true, "peak_rss_mb": 8451.9 },
      "cpu": { "median_ms": 261021.7, "runs": 8, "receipt_verified": true, "peak_rss_mb": 10674.6 },
      "speedup": 1.739,
      "evidence": {
        "bundle": "evidence/20260616T133558Z",
        "evidence_json_sha256": "c400bf192ab675b2146ca11743836de0e8871e2125761581033902d83fde7813",
        "metal_csv_sha256": "e0f11f78b3b2e3283e5b4387723b813f4b235536f7d84d85f8fd4be1f98be619",
        "cpu_csv_sha256": "0de8d961468a510a270e4e3e1060de60444f400033767c5ba3de16f563fc6e93",
        "profile_log_sha256": null,
        "notes": "v0.3.0 release-tree re-measure (validate.sh --full --require-metal, master @ a884a158); canonical JSON is evidence.json; CSVs are bench/busy-{metal,cpu}.csv. profile_log is null: validate.sh profiles only `hello`; the lane-invariant floor is confirmed for `busy` in RESULT.md's phase table."
      }
    },
    {
      "name": "multiseg",
      "segments": 9,
      "knobs": { "R0_MULTISEG_ITERS": "1500000" },
      "metal": { "median_ms": 226393.7, "runs": 5, "receipt_verified": true, "peak_rss_mb": 8506.7 },
      "cpu": { "median_ms": 391705.0, "runs": 5, "receipt_verified": true, "peak_rss_mb": 10602.5 },
      "speedup": 1.730,
      "evidence": {
        "bundle": "evidence/adopter-20260615T102417Z",
        "evidence_json_sha256": "ec7ff1f8ab3759a36e123afedfdaed8552050d9092c35cd976382c9faec87f08",
        "metal_csv_sha256": "94c348d554e9bd52bb4067d591014633d73e5f1b3a066b160c94c103ce552bbb",
        "cpu_csv_sha256": "9b1780012900a429ef7fb74ca6996dc2ab790d0b019c97dfaf560f51b55cd8e9",
        "profile_log_sha256": "d51efb109081fd6ddaee7cb2d4c027f3dcb8e8b6975695d012916d9a2c06212f",
        "notes": "bench-adopter.sh bundle (unchanged at v0.3.0; the --full re-measure covers hello/hash/busy only). Its canonical machine-readable JSON is summary.json (bench-adopter writes summary.json, not evidence.json). metal/cpu CSVs are bench/multiseg-{metal,cpu}.csv; profile_log is logs/profile-multiseg-metal.log. Protocol: 1 warm-up + 5 serial runs/lane, receipt verified + journal asserted each run."
      }
    },
    {
      "name": "mempress",
      "segments": 7,
      "knobs": { "R0_MEMPRESS_WORDS": "256000" },
      "metal": { "median_ms": 176109.5, "runs": 5, "receipt_verified": true, "peak_rss_mb": 8314.1 },
      "cpu": { "median_ms": 305050.1, "runs": 5, "receipt_verified": true, "peak_rss_mb": 10545.0 },
      "speedup": 1.732,
      "evidence": {
        "bundle": "evidence/adopter-20260615T102417Z",
        "evidence_json_sha256": "ec7ff1f8ab3759a36e123afedfdaed8552050d9092c35cd976382c9faec87f08",
        "metal_csv_sha256": "3258915ba837811eb7c46a10bb83de442b59f31f518979e8dcc6adb9a78b742a",
        "cpu_csv_sha256": "a53a925239a3a6f5b3fb3fb34811c8f6b94b0e4be6fee9b4eaf672cf60625b59",
        "profile_log_sha256": "75c4d864e8628533f6e77a4cb268bd3e393dbf3e85b2a51cf47977d61e2f5321",
        "notes": "bench-adopter.sh bundle (unchanged at v0.3.0); canonical JSON is summary.json. metal/cpu CSVs are bench/mempress-{metal,cpu}.csv; profile_log is logs/profile-mempress-metal.log. Protocol: 1 warm-up + 5 serial runs/lane, receipt verified each run."
      }
    },
    {
      "name": "shaheavy",
      "segments": 5,
      "knobs": { "R0_SHAHEAVY_KB": "16", "R0_SHAHEAVY_ROUNDS": "4" },
      "metal": { "median_ms": 113482.7, "runs": 5, "receipt_verified": true, "peak_rss_mb": 8405.8 },
      "cpu": { "median_ms": 195430.3, "runs": 5, "receipt_verified": true, "peak_rss_mb": 13313.5 },
      "speedup": 1.722,
      "evidence": {
        "bundle": "evidence/adopter-20260615T102417Z",
        "evidence_json_sha256": "ec7ff1f8ab3759a36e123afedfdaed8552050d9092c35cd976382c9faec87f08",
        "metal_csv_sha256": "beddb2557419754d952382684e93b8b77ac4a065719feefcafd747ab70db8e45",
        "cpu_csv_sha256": "ea1d66b19a5ce73fcbeb0f42518f3f4a4b5b0f666c5fe71698c1804356241037",
        "profile_log_sha256": "a32bdbcad0a344a63cc5e99384097d71d4933a400d30965e0c25a58cefa5f2bd",
        "notes": "bench-adopter.sh bundle (unchanged at v0.3.0); canonical JSON is summary.json. metal/cpu CSVs are bench/shaheavy-{metal,cpu}.csv; profile_log is logs/profile-shaheavy-metal.log. Protocol: 1 warm-up + 5 serial runs/lane, receipt verified each run."
      }
    },
    {
      "name": "ecdsa",
      "segments": 6,
      "knobs": { "R0_ECDSA_SIGS": "1" },
      "metal": { "median_ms": 151650.0, "runs": 5, "receipt_verified": true, "peak_rss_mb": 7808.4 },
      "cpu": { "median_ms": 261376.3, "runs": 5, "receipt_verified": true, "peak_rss_mb": 10196.4 },
      "speedup": 1.724,
      "evidence": {
        "bundle": "evidence/adopter-20260615T102417Z",
        "evidence_json_sha256": "ec7ff1f8ab3759a36e123afedfdaed8552050d9092c35cd976382c9faec87f08",
        "metal_csv_sha256": "488fd163b8a440a103341e322ec182cbabefe1bf97c7286f58fd0a8c74fece9d",
        "cpu_csv_sha256": "0740260b1604c913233f889be8b226072c243f8f30ae6846c3451e58a1bf59d5",
        "profile_log_sha256": "8b55e41f304eb7fe6748c72b17c3f292e72a96f08bff1fd0870a168b128cd8ed",
        "notes": "bench-adopter.sh bundle (unchanged at v0.3.0); canonical JSON is summary.json. metal/cpu CSVs are bench/ecdsa-{metal,cpu}.csv; profile_log is logs/profile-ecdsa-metal.log. Protocol: 1 warm-up + 5 serial runs/lane, receipt verified each run."
      }
    }
  ],
  "evidence": {
    "bundle": "evidence/20260616T133558Z",
    "evidence_json_sha256": "c400bf192ab675b2146ca11743836de0e8871e2125761581033902d83fde7813",
    "verdict": "PASS"
  },
  "measured_at_utc": "20260616T133558Z",
  "notes": "v0.3.0 release-tree measurement. hello/hash/busy were re-measured on master @ a884a158 with validate.sh --full --require-metal (PASS 34/0/0; 1 warm-up + 8 serial runs/lane; receipt verified + journal asserted each run; CPU lane via R0_DISABLE_METAL=1) — bundle evidence/20260616T133558Z (top-level pointer). Speedups 1.638/1.748/1.739x for hello/hash/busy are within run-to-run variance of the v0.2.0/Phase-0 figures (1.70/1.63/1.70x and 1.571/1.734/1.766x); the structural story (eval_check CPU floor bounds the speedup) is unchanged. The multiseg/mempress/shaheavy/ecdsa adopter rows are unchanged from the Phase 2 bundle evidence/adopter-20260615T102417Z (summary.json sha256 ec7ff1f8ab3759a36e123afedfdaed8552050d9092c35cd976382c9faec87f08), 1 warm-up + 5 serial runs/lane, all clustering at 1.722x-1.732x with a measured ~87% (eval_check ~83%) circuit floor. Each workload's exact files are pinned in its own per-workload evidence block; the speedup holds across single-segment, multi-segment, real-dependency sha2/k256, memory-pressure, and ECDSA-verify workloads and does not erode toward 1x at these sizes."
}
