{
  "schema_version": "r0mh-results-v1",
  "chip": "Apple M3 Ultra",
  "chip_key": "apple-m3-ultra",
  "status": "not_measured",
  "not_measured_reason": "awaiting hardware — not measured. Run scripts/validate.sh --require-metal --full on this chip and submit per CONTRIBUTING-BENCHMARKS.md.",
  "hardware": { "cpu_cores": 0, "gpu_cores": 0, "ram_bytes": 0 },
  "os": { "name": "macOS", "version": "unknown" }
}
